{
  "contract_version": "0.1.0",
  "stability": "experimental",
  "extensions": {},
  "native_representation_id": "sha256:72182f254c13df619e08d78ba8f0a10f67e9b43e764aacfbb83243ab1a3b3465",
  "source_version_id": "sha256:aaaaaaaaaaaaaaaaaaaaaaaaaaaaaaaaaaaaaaaaaaaaaaaaaaaaaaaaaaaaaaaa",
  "native_artifact_id": "sha256:bbbbbbbbbbbbbbbbbbbbbbbbbbbbbbbbbbbbbbbbbbbbbbbbbbbbbbbbbbbbbbbb",
  "native_artifact_media_type": "application/json",
  "native_artifact_byte_length": 123,
  "provider": {
    "name": "synthetic-rich-parser",
    "version": "1.2.3",
    "profile": "portable",
    "profile_version": "0.4.0",
    "config_hash": "sha256:cccccccccccccccccccccccccccccccccccccccccccccccccccccccccccccccc"
  },
  "created_at": "2026-07-26T12:00:00Z"
}
